{
  "$schema": "http://json-schema.org/draft-07/schema#",
  "$id": "operation_params_v1.schema.json",
  "title": "Operation params — reusable bundle of parameter values for a derivation",
  "description": "One JSON per parameter bundle, under <registry_root>/operation_params/<operation_params_id>.json. Decoupled from derivation_v1 so two derivations can reuse the same bundle. The params object's shape depends on operation_type — same parameter bundle should only ever be referenced by derivations of the same operation_type. Per SETS_AND_ANALYSES.md §'Operation parameters'.\n\nFor thinning-style ops the bundle records distance_bp, sort_key, choice_rule, reset_scope, deterministic+seed. For window-extract ops it records window_size, step, chrom_filter. For random_sample it records n, seed, with_replacement. The 'extras' field is a free-form object for op-specific knobs that don't fit the canonical fields.",
  "type": "object",
  "required": ["operation_params_id", "operation_type", "params", "deterministic"],
  "additionalProperties": true,
  "properties": {
    "operation_params_id": {
      "type": "string",
      "pattern": "^[a-z][a-z0-9_]*$",
      "description": "Stable id. Convention: '<operation_short>_<distinguishing_choice>_v<N>' (e.g. 'thin500_first_per_chrom_v1', 'thin500_random_seed123_v1', 'lostruct_LG28_params_v1')."
    },
    "operation_type": {
      "type": "string",
      "description": "Which operation kind this bundle is for (mirrors derivation_v1.operation_type). The 'params' shape is operation-type-specific."
    },
    "label": {
      "type": "string",
      "description": "Human-readable display label."
    },
    "params": {
      "type": "object",
      "description": "Parameter values. Schema is operation-type-specific. Canonical fields per common operations are documented in _common_param_fields below; atlases may extend.",
      "additionalProperties": true
    },
    "deterministic": {
      "type": "boolean",
      "description": "True = bit-identical output for the same parent + params (no randomness). False = output depends on RNG state (seed should be set)."
    },
    "seed": {
      "type": ["integer", "string", "null"],
      "description": "RNG seed when deterministic=false. Null/absent when deterministic=true."
    },
    "version_of_definition": {
      "type": "string",
      "description": "Optional semver of the params interpretation. Lets you bump when you discover that a previously-accepted ambiguity in the params actually matters."
    },
    "created_at": { "type": "string", "format": "date-time" },
    "created_by": { "type": "string" },
    "notes":      { "type": "string" }
  },
  "_common_param_fields": {
    "_description": "Documentation only — not validated. Canonical params keys per common operation_type.",
    "thin_by_distance": [
      "distance_bp           (int)    minimum bp between kept sites",
      "reset_scope           (str)    'chromosome' | 'scaffold' | 'genome'",
      "sort_key              (str)    'chrom,pos' typically",
      "choice_rule           (str)    'first_valid_site_after_previous_kept_site' | 'random_one_per_bin' | 'max_info_per_bin' | …",
      "tie_break             (str)    optional"
    ],
    "window_extract": [
      "window_size_bp        (int)",
      "step_bp               (int)    if sliding; absent for tiling",
      "chrom_filter          (str/null)",
      "min_sites_per_window  (int)    drop windows below this",
      "min_callability       (float)"
    ],
    "random_sample": [
      "n_keep                (int)",
      "with_replacement      (bool)",
      "stratify_by           (str/null)"
    ],
    "callability_filter": [
      "min_callability       (float)",
      "min_depth             (int)",
      "max_missingness       (float)"
    ]
  },
  "_examples": [
    {
      "_description": "thin500 — deterministic, first valid site per 500 bp, reset per chromosome.",
      "operation_params_id": "thin500_first_per_chrom_v1",
      "operation_type":      "thin_by_distance",
      "label":               "Thin to 1 site / 500 bp, first valid, per chromosome",
      "params": {
        "distance_bp":  500,
        "reset_scope":  "chromosome",
        "sort_key":     "chrom,pos",
        "choice_rule":  "first_valid_site_after_previous_kept_site"
      },
      "deterministic": true,
      "seed":          null,
      "created_at":    "2026-04-08T11:40:00Z"
    },
    {
      "_description": "Same distance, different choice rule, with seed.",
      "operation_params_id": "thin500_random_seed123_v1",
      "operation_type":      "thin_by_distance",
      "label":               "Thin to 1 site / 500 bp, random per bin, seed 123",
      "params": {
        "distance_bp":  500,
        "reset_scope":  "chromosome",
        "sort_key":     "chrom,pos",
        "choice_rule":  "random_one_per_bin"
      },
      "deterministic": false,
      "seed":          123,
      "notes":         "DIFFERENT operation_params_id than thin500_first_per_chrom_v1 even though distance_bp is the same — the choice_rule and seed differ. Two sites_thin500_*_v1 sets that reference these will be DIFFERENT files."
    },
    {
      "_description": "lostruct window extraction for LG28.",
      "operation_params_id": "lostruct_LG28_params_v1",
      "operation_type":      "window_extract",
      "params": {
        "window_size_bp":       100,
        "chrom_filter":         "C_gar_LG28",
        "min_sites_per_window": 10,
        "min_callability":      0.5
      },
      "deterministic": true
    }
  ]
}
