{
  "operation_params_id": "thin500_random_seed123_v1",
  "operation_type":      "thin_by_distance",
  "label":               "Thin to 1 site / 500 bp — random per 500-bp bin, seed 123",
  "params": {
    "distance_bp":  500,
    "reset_scope":  "chromosome",
    "sort_key":     "chrom,pos",
    "choice_rule":  "random_one_per_bin"
  },
  "deterministic": false,
  "seed":          123,
  "created_at":    "2026-04-08T11:41:00Z",
  "notes":         "Same distance_bp as thin500_first_per_chrom_v1 but DIFFERENT choice_rule + seed → DIFFERENT bundle → different output."
}
