{
  "operation_params_id": "thin500_first_per_chrom_v1",
  "operation_type":      "thin_by_distance",
  "label":               "Thin to 1 site / 500 bp — first valid, per chromosome",
  "params": {
    "distance_bp":  500,
    "reset_scope":  "chromosome",
    "sort_key":     "chrom,pos",
    "choice_rule":  "first_valid_site_after_previous_kept_site"
  },
  "deterministic": true,
  "seed":          null,
  "created_at":    "2026-04-08T11:40:00Z",
  "notes":         "Default thinning for popstructure analyses. Deterministic."
}
